<?xml version="1.0" encoding="ISO-8859-1" ?>
<clientes xmlns="http://www.clientes.es" xmlns:xsi="http://www.w3.org/2001/XMLSchema-instance" xsi:schemaLocation="http://www.clientes.es clientes.xsd">
	<!--
 idcliente es un numero de entre 3 y 15 digitos
 dni 8 digitos y una letra
 sexo Hombre o Mujer
 tipo una letra
 el contenido del elemento numero tiene que ser mayor que 0 
 -->
	<cliente idCliente="A8142200" dni="11111111a" localidad="Madrid">
		<nombre>Antonio</nombre>
		<direcciones>
			<direccion>
				casa
				<ciudad>M�laga</ciudad>
				<calle>Larios</calle>
				<numero tipo="c">5</numero>
			</direccion>
			<direccion>
				trabajo
				<ciudad>Madrid</ciudad>
				<calle>Alcal�</calle>
				<numero tipo="c">120</numero>
			</direccion>
		</direcciones>
	</cliente>
	<cliente idCliente="B8155533" dni="22222222b" sexo="Hombre">
		<nombre>Jose Carlos</nombre>
		<apellido1>Mart�nez</apellido1>
	</cliente>
	<cliente idCliente="C8188878" dni="33333333c" sexo="Mujer">
		<nombre>Josefa</nombre>
		<apellido1>Mart�n</apellido1>
		<apellido2>Fern�ndez</apellido2>
	</cliente>
</clientes>